{
  "device_uid": "esp32-A1B2C3D4E5F6",
  "device_id": "esp32_01",
  "event_type": "device_status",
  "timestamp": 1788307200,
  "accel_magnitude": 1.01,
  "gyro_magnitude": 8.4,
  "immobility_confirmed": false,
  "battery_percent_source": "not_configured",
  "detector_mode": "normal",
  "threshold_profile": "normal",
  "sample_interval_ms": 50,
  "telemetry_interval_ms": 2000,
  "fft_enabled": false,
  "wifi_rssi": -58,
  "rssi": -58,
  "buffered_events": 0,
  "sample_seq": 341,
  "sensor_ready": true,
  "sensor_valid": true,
  "sensor_read_ok": true,
  "sensor_sample_age_ms": 18,
  "sensor_failures": 0,
  "i2c_error_count": 0,
  "i2c_recovery_count": 0,
  "i2c_last_error": "none",
  "boot_id": "b0000002a-5f3c9e10",
  "critical_outbox": {
    "pending": 0,
    "capacity": 16,
    "not_persisted": 0,
    "store_available": true,
    "oldest_age_ms": 0,
    "overflow_count": 0,
    "too_large_count": 0,
    "persist_failures": 0,
    "corrupted_on_load": 0,
    "acked": 3,
    "duplicate_acks": 1,
    "unknown_acks": 0,
    "invalid_acks": 0,
    "last_ack_age_ms": 41250,
    "ack_subscribed": true
  }
}
